,Comment,User,Date,Post
807,и когда будут известны результаты,375917464,1488387598,5185
808,"[id375917464|Саша], собеседование и вступительные задания - это два альтернативных способа попасть в КЛШ; если Вы не вполне уверены в том, что выполнили вступительные задания на сто из ста, есть смысл сходить на собеседование. В расчёт будет приниматься высший балл. Результаты зачисления будут известны в концы апреля и разосланы всем участникам отборочных испытаний электронной почтой.",-49558,1488397003,5185
809,"[id375917464|Sasha], собеседование и задание оба учитываются в отборе. Возможно, берётся лучший результат из двух.",7094449,1488463639,5185
810,А что из себя представляет собеседование?,375917464,1488464210,5185
811,"[id375917464|Саша], вам будет предложен набор задач для решения по интересующему направлению; по готовности решения обсуждаются с сотрудниками КЛШ.",-49558,1488472674,5185
812,Собеседование в случае неудачного прохождения ухудшает балл по заочному заданию?,3384879,1488547369,5185
813,"Почитала внимательно предыдущие ответы, что в зачет принимается высший балл)",3384879,1488547444,5185
814,"Добрый день. Подскажите, пожалуйста, в какие сроки планируется КЛШ?",26276154,1488597890,5185
815,"[id26276154|Елена], сезон пройдёт с 16 июля по 5 августа",-49558,1488649356,5185
816,Спасибо,26276154,1488649672,5185
817,"А можно ли прийти на собеседованик, если не проходил вступительные задания, т.к. узнал о КШЛ пару дней назад?",201796316,1489645950,5185
818,"[id201796316|Sofia], можно, приходи )",377866785,1489651513,5185
819,"[id201796316|Sofia], собеседование во многом делается для тех, кто слишком поздно узнал о КЛШ и/или не имел возможности написать вступительное задание",377866785,1489651787,5185
820,"[id377866785|Stas], спасибо. Нужно ли что-то иметь при себе на собеседование? Какие-либо документы, или же канцелярию?",201796316,1489651887,5185
821,"[id201796316|Sofia], ручку и бумагу )",377866785,1489676466,5185
822,"Спасибо, что напомнили! Уже сажусь писать ответы на ваши коварные вопросы☝",152984095,1487439410,5175
823,А когда будет известна дата собеседования?,88365103,1487516451,5175
824,"[id88365103|Екатерина], она известна! 19.03, выше объявление ;)",580818,1489340362,5175
825,Браво!,10578982,1486146017,5171
826,Только я Цепелева😁 а не Чепелева😅,145138904,1481731552,5144
827,"[id145138904|Юлия], старинная летнешкольная мудрость: 'как зондера бегунок подпишут, так сами же потом и прочитают'🙈приносим извинения, в базах у себя всё исправили!",-49558,1481786302,5144
828,"Хэй 👀 Исправьте фамилию, пожалуйста :) я Шубкина, а не Шубина :))",282056235,1481813846,5144
829,"[id282056235|Anna], 🙈👾👌",-49558,1482043738,5144
830,"То чувство, когда хочешь, но не можешь...",163406594,1481042944,5137
831,"[id163406594|Николь], очень жаль, мы были бы очень рады встрече(",1317792,1481127821,5137
832,"[id1317792|Диана], я тоже.. но увы..😢😭",163406594,1481127871,5137
833,Где можно узнать результаты?,173284181,1481643970,5137
834,"[id173284181|Евгений], скоро-скоро опубликуем в группе!",-49558,1481665094,5137
835,Зеленогорск?! Ничего себе,52793528,1474811797,5100
836,А почему же у детей гамоты без подписи и печати ? Я мама участника этого биатлона. Парни заняли первое место..,45890521,1474817210,5100
837,"[id52793528|Лиза], да, приехало 2 команды - по одном в каждом зачёте, и обе взяли по призовому месту🔥🔥🔥",-49558,1474853755,5100
838,"[id45890521|Татьяна], ого! Я была уверена, что расписалась везде, где только возможно! Приношу свои извинения(",1317792,1474853896,5100
839,А во сколько будет биатлон?),83301008,1474879534,5100
840,"[id83301008|Галина], в 10 регистрация, в 10:45 старт))",-49558,1474883310,5100
841,Чего то фот не густо 😕,5108340,1474909097,5100
842,"[id5108340|Алексей], фотографии размещены в альбоме https://vk.com/album-49558_236243658",-49558,1474960565,5100
843,"Простите за недопонимание, зачем отдельно материалы и на дисках, и через сеть?",371417452,1472994677,5084
844,"по приколу. Диски - память, сеть - для тех, кому память не дошла :p",176438353,1472998278,5084
845,"[id371417452|Сергей], в дополнение к Никите: на диски, к сожалению, вошло далеко не всё, что достойно документирования и сохранения😉",-49558,1473029049,5084
846,"А как можно получить диски тому, кто живет не в Красноярске?",157378806,1473236015,5084
847,"[id157378806|Анастасия], свяжись с вожатыми, они отправят!",1317792,1473255804,5084
848,давайте выкладывать таки,8859861,1470967628,5053
849,тру),1443643,1470916420,5047
850,Как круто жеж!,791387,1470916872,5047
851,Артём Абанов и его бригада 😂😂😂,1317792,1467652333,4920
852,"Нет, ну я бы попросил!",1097762,1468174486,4920
853,"Кстати, что необычного есть на этой фото?",4223712,1466706372,4907
854,"Андрей, я знаю, чего нет.  Вредных уборщиц нет
Палатки ещё",197960654,1466743573,4907
855,"Андрей, что из окна торчит?!",176438353,1466779847,4907
856,"[id4223712|Андрей], карандаш внизу?)",216786501,1466790926,4907
857,Новая беседка,294138644,1466860211,4907
858,И вот появился победитель=),4223712,1466957283,4907
859,"Андрей, я поступлю за это в КЛШ?",294138644,1468413617,4907
860,Ламзина здесь не хватает,80681663,1466409755,4895
861,Мусорки справа на углу,294138644,1466413975,4895
862,"Садовского в шляпке
*Ой манит начинаете, ой уже охота в КЛШ*",176438353,1466414046,4895
863,Меня)),37297343,1466414448,4895
864,"Не кого, а чего: всегда креативного расписания дня)",43215072,1466417465,4895
865,Слева от входа стол стоял,338666005,1466422137,4895
866,"Адо, есть борода! ?",93790230,1466427561,4895
867,Не вижу громкоговорителя,294138644,1468413696,4895
868,И стола для рации для вызова на арку,294138644,1468413734,4895
869,вечные ценности,319989,1466082089,4891
870,А на тех ступеньках будут ждать обеда порция голодных детей...,176438353,1466246514,4891
871,"[id176438353|Никита], главное, чтобы руки мыли школьников вовремя!)",353835640,1466267822,4891
872,А бумажные письма будут?,83301008,1461158096,4842
873,"[id83301008|Галина], зачисленным школьникам будут высланы бумажные письма с договорами",1317792,1461164249,4842
874,"Здравствуйте. Подскажите, пожалуйста, уже известны даты, в которые будет проходить КЛШ?",26276154,1457925299,4819
875,"[id26276154|Елена], добрый день! С высокой степенью вероятности с 16 июля по 5 августа",1317792,1457926380,4819
876,"[id1317792|Диана], Спасибо.",26276154,1457926753,4819
877,Где можно будет посмотреть результаты зачисления?,127000790,1461078168,4819
878,Может быть у ММШ есть группа вконтакте?,6259325,1457587566,4786
879,Есть шанс попасть в ММШ и КЛШ не у красноярцев?,8179743,1457591903,4786
880,"[id8179743|Ирина], шанс есть, если не сказать большего!)",1317792,1457594876,4786
881,А подробности? :),8179743,1457594918,4786
882,"[id8179743|Ирина], приезжайте на собеседование, проходите в КЛШ. По поводу ММШ надо связаться с их организаторами.",1317792,1457595952,4786
883,Из Новосибирска? Заочно - никак?,8179743,1457597316,4786
884,"[id8179743|Ирина], к сожалению, сроки подачи заочных вступительных заданий уже истекли.",1317792,1457598385,4786
885,"[id6259325|Александр], https://vk.com/mmshedu",1317792,1457618797,4786
886,"Диана, спасибо за оперативные ответы!
Ирина, написала вам в личку про некрасноярских ММШкольников.",580818,1457633408,4786
887,"Здравствуйте! подскажите, пожалуйста, в этом посте информация о том, что приглашаются учащиеся 5-7 классов, а на сайте КЛШ приглашаются ученики 8-10 классов?..",65361971,1457665297,4786
888,"[id65361971|Оксана], ММШ и КЛШ - это две разные школы.",41626696,1457671601,4786
889,А в Москве собеседования не будет?,29173914,1457343640,4773
890,"[id29173914|Daria], с высокой степенью вероятности будет; место и время пока уточняются 🐣",1317792,1457417516,4773
891,"""Расписание олимпиады и предварительная регистрация на сайте http://www.klsh.ru/"" — есть мнение, что-таки расписание собеседования, а не олимпиады",1455755,1457426898,4773
892,"[id1455755|Владислав], 😩 ну где ж ты был до этих 42 репостов 🐣",1317792,1457492674,4773
893,"[id1317792|Diana], лежал на печи, ждал мудрецов )",1455755,1457503689,4773
894,"[id29173914|Daria], https://vk.com/wall-49558_4794",1317792,1457610805,4773
895,С собой - решение филологической задачи: на каком же острове (с точки зрения правил русской грамматики) пройдёт интенсивная работа над собой 2 января Нового года?🤔🤔🤔,1317792,1451683580,4742
896,Мы тут!,182268767,1451729855,4742
897,,147977060,1451586854,4740
898,"Забавно, что они в топ биотехнологических вузов записали Дальрыбвтуз, а ДВФУ проигнорировали.",308071,1448900221,4728
899,> в середине мата,36614984,1448806942,4719
900,"Ахаха, 97 из ста",294138644,1448812948,4719
901,"[id36614984|Сергей], спасибо, поправили ;)",-49558,1448828562,4719
902,"А результаты ""Гонки на выживание"" будут?",215940677,1448862129,4719
903,А за 4 место в общем зачете  какая нибудь грамота вручается?,1866463,1448891040,4719
904,Сколько всего участников зарегистрировалось?,87016019,1448894808,4719
905,"[club49558|Красноярская Летняя Школа / КЛШ], здравствуйте, мне 13 и я бы летом очень хотела попасть в вашу школу, что для этого требуется ?",52076749,1448982014,4719
906,"[id52076749|Стефания], добрый день! Необходимо выполнить вступительное задание 2016, найти его можно на нашем сайте: klsh.ru. В середине марта будет проходить собеседование, следите за новостями)",1317792,1449052557,4719
907,"[id52076749|Стефания], так же можно попасть в КЛШ, если хорошо выступить на краевой олимпиаде",133108354,1449246495,4719
908,а только у меня ньюслаб постоянно заблокирован?:(,52793528,1448486953,4714
909,А почему только Тёма? Там и другие летние сотрудники есть!,4251,1448740196,4714
910,"[id52793528|Лиза], у меня тоже заблокирован",7947938,1448801830,4714
911,Результаты! Результаты!,294138644,1448350009,4689
912,Крысу!,4056675,1442419510,4636
913,"Прости, вожатый!",7094449,1442476341,4636
914,"Никак не мог ""Момент на Массу"" сыграть - теперь хоть пойму. Спасибо - наконец треклист пополниться Легендарными песнями! Гоп-стоп кстати можно сыграть - очень популярная была песня ( в кругах одной команды) 😆",176438353,1442476446,4636
915,Даёшь физтеховский оригинал Медианы!,1455755,1442478292,4636
916,"Ленин и дети,про садовского,йожин з бажин,аквалангисты,красу,гоп-стоп,зондер,гимн аэрофизиков,раскинулось мрое по модулю 5,прости вожатый,друг мой,",195422277,1442479041,4636
917,А как же физматик ? 😢,167290782,1442571990,4636
918,"В наш и без того беспокойный век непедагогично пропагандировать милитаристские и садистские песни. Но я всё равно хотел бы услышать в хорошем качестве ""Пентагону"" и ""Гемостаз"".",308071,1442612240,4636
919,Каждому-каждому хочется повеситься падает-падает ядерный фугас (на Столбах пели),311586178,1443200430,4636
920,Про Садовского еще спойте!,268526829,1443629288,4636
921,Антона забыли!,86538447,1443724530,4636
922,"[id176438353|Никита], я даже знаю, какой))",212556743,1470496582,4636
923,Хе-хе ;),176438353,1470497157,4636
924,Аеее!,133382693,1441194420,4603
925,"О, Столбы!)) Круто)) А я думал до след. лета уже все",311586178,1441298355,4603
926,Ура-Ура-Ура!! диски:)),163406594,1441385645,4603
927,"Почему Столяр, а не Смоляр?",308071,1441021294,4599
928,"[id308071|Артем], всему свое время))",160158126,1441048990,4599
929,"от безумно счастливого к суровому :) удачи, Ванечка! 
уже ждем вас :)",182268767,1439381175,4523
930,хм,4223712,1438873326,4440
931,"кондукторы обычно выживают, а вот готовы ли родители к таким испытаниям?",4223712,1438873374,4440
932,Урааа с:,143820948,1436766636,4355
933,"Я сегодня встречался с какими-то парнями на Тульской, мне дали микрофон, заставляли петь.",7094449,1434832591,4318
934,"Раз уж гордитесь своим пением и готовитесь к юбилейному сезону, будьте готовы дежурить с гитарой на крыльце столовой ежедневно. Я прослежу.",308071,1434834785,4318
935,Вы ещё онлайн-трансляцию с крыльца обеспечьте – я буду следить ночами;),29253,1434837127,4318
936,А Наташку куда дели?),17656236,1434853623,4318
937,"А ты думаешь, кто фотографию делает?:)",7094449,1434871366,4318
938,Так и подумала :),17656236,1434871408,4318
939,ТАРИМСЯ ЕДОЙ,152984095,1435239980,4318
940,Макс?,176040075,1436350732,4318
941,"[id176040075|Polina], Макс.",7094449,1436452255,4318
942,"[id7094449|Nikita], отлично, а какое участие он будет принимать?",176040075,1436452417,4318
943,Пора начать собирать камеру Вильсона!,7094449,1432188297,4260
944,Не пришло на электронку 😔,199964540,1432202507,4260
945,"[id199964540|Maria], напишите нам на почту klsh@klsh.ru письмо с темой ""не пришло письмо_ФИО"", мы перешлём!",-49558,1432230900,4260
946,"[club49558|Красноярская Летняя Школа / КЛШ], сделано!",199964540,1432233636,4260
947,А в Москве собеседование будет?,98256898,1428000364,4176
948,По московскому собеседованию будет отдельная информация!,-49558,1428343274,4176
949,Сколько по времени будет длиться собеседование?,158353147,1429549872,4176
950,А что стоит?:) я участник клш!,7094449,1427282370,4166
951,Я б тоже...,41626696,1427283977,4166
952,"[id7094449|Никита], тебе ещё и приплатят, потому что будешь преподавать. :)",768587,1427284517,4166
953,"[id41626696|Оксана], звоните 2595979, подберем для Вас",4116331,1427342341,4166
954,"[id7094449|Никита], позвоните нам 2595979 - все расскажем!",4116331,1427342367,4166
955,Возникает вопрос: Сколько в этом году останется конкурсных мест?,152984095,1423825633,4127
956,"[id152984095|Даша], на вас хватит)",1317792,1423836874,4127
957,"А если школьник из Красноярска хочет попробовать себя, ему можно порешать задачки))?",50411526,1424013325,4127
958,"[id50411526|Ирина], порешать можно, но в интенсиве поучаствовать не получится(",1317792,1424013391,4127
959,"[id1317792|Диана], спасибо за быстрый ответ:)!",50411526,1424013409,4127
960,А я считаюсь школьником из Железногорска? :D,34746243,1424881078,4127
961,"Здравствуйте. Отбор по итогам решения вступительных заданий на интенсив еще идет, или результаты уже известны?",179117632,1424929674,4127
962,Ура!,1854019,1422505014,4117
963,"4 в общем зачете, 4 по точным.",133108354,1418992659,4089
964,Все таки у тебя 85,50218215,1418997038,4089
965,"[id133108354|Вячеслав], П - победитель",54300321,1419011284,4089
966,"Ой, призёр",54300321,1419011304,4089
967,"[id54300321|Роман], ой, проигравший...",54300321,1419011312,4089
968,А сколько всего было участников олимпиады? Человек триста было?,116916607,1419015995,4089
969,Поздравляю победителей!:) Приходите ко мне на курс в КЛШ (не реклама!),7094449,1419023170,4089
970,"[id116916607|Анастасия], бегунки сдали 214 участников",1317792,1419050040,4089
971,"[id1317792|Диана], спасибо.",116916607,1419080236,4089
972,А это будет олимпиада на попадание в КЛШ?,86218166,1417681812,4052
973,"[id86218166|Андрей], победители олимпиады будут приглашены в КЛШ вне конкурса.",-49558,1417686696,4052
974,Этапов будет несколько на каждое направление  или одно направление-один этап?,133108354,1417877242,4052
975,Несколько. На каждом направлении будет одинаковое количество этапов.,4470242,1417886104,4052
976,"Напишите, пожалуйста, общее время проведение олимпиады.",147977060,1418347320,4052
977,"[id147977060|Влад], зарегистрироваться необходимо до 11:30 (и тем, кто уже зарегистрировался онлайн, и тем, кто этого не сделал), сама олимпиада будет проходить с 12:30 до 15:30, награждение - в 16:30",-49558,1418448491,4052
978,А можно участвовать в нескольких олимпиадах?),151530013,1418483916,4052
979,"На мой взгляд нынешняя система олимпиады несправедливая. Физика и математика есть у всех, а медицина с филологией и юриспруденцией не у всех. Ну и дробление на кучу мелких задач может не дать необходимой точности измерения. Задачи должны быть сложными. Для решения кучи простых как правило внимательность только нужна. Лучше вернуться к старой системе с 4 направлениями.",8859861,1418547350,4052
980,А мне очень понравилось:) было классно и интересно),206971735,1418661895,4052
981,"[id206971735|Jelly], я говорил что не справедливо, и не логично. А классно и интересно вполне согласен",8859861,1418718085,4052
982,"Интересно, однако:)",114262484,1417179355,4042
983,Когда состоится? И школьники каких классов могут участвовать?,6259325,1417179480,4042
984,"В середине декабря примерно, с 7 класса.",13452623,1417179998,4042
985,"[id6259325|Alexander], кажется, что дата указана в первом предложении текста.",7094449,1417180787,4042
986,"[id7094449|Никита], Ух ты! :) То ли я не прочитал в первый раз, то ли ее не было, спасибо :)",6259325,1417180845,4042
987,А на какое направление повезете победителя?,152984095,1417434528,4042
988,"[id152984095|Даша], абсолютный победитель сам сможет выбрать направление.",13452623,1417437639,4042
989,"[id13452623|Lada], только один?",7094449,1417506650,4042
990,"Абсолютный, вроде, да. Нужно в положении посмотреть. Но будут определены также и победители по направлениям.",13452623,1417511409,4042
